{"schema_version":1,"instance_id":"structured-simulation-v0-f4626338ebcedc25","family_id":"structured-simulation-v0","answer":{"records":[{"id":"R1","status":"draft","score":8},{"id":"R2","status":"ready","score":18},{"id":"R3","status":"rejected","score":15},{"id":"R4","status":"ready","score":1}],"changed_paths":["records/2/status"]}}