{"schema_version":1,"instance_id":"structured-simulation-v0-3c93d8d99c40adc3","family_id":"structured-simulation-v0","answer":{"records":[{"id":"R1","status":"review","score":1},{"id":"R2","status":"draft","score":11},{"id":"R3","status":"ready","score":16},{"id":"R4","status":"approved","score":5}],"changed_paths":["records[3].status"]}}