{"schema_version":1,"instance_id":"structured-simulation-v0-1161a7880b6fad2d","family_id":"structured-simulation-v0","answer":{"records":[{"id":"R1","status":"rejected","score":14},{"id":"R2","status":"draft","score":16},{"id":"R3","status":"draft","score":13},{"id":"R4","status":"draft","score":14}],"changed_paths":["/records/0/status"]}}