{"schema_version":1,"instance_id":"structured-simulation-v0-893e2ad79a7561a7","family_id":"structured-simulation-v0","answer":{"records":[{"id":"R1","status":"draft","score":17},{"id":"R2","status":"rejected","score":5},{"id":"R3","status":"review","score":16},{"id":"R4","status":"ready","score":17}],"changed_paths":["/records/1/status"]}}