{"schema_version":1,"instance_id":"structured-simulation-v0-a08ad82da547408a","family_id":"structured-simulation-v0","answer":{"records":[{"id":"R1","status":"review","score":2},{"id":"R2","status":"review","score":11},{"id":"R3","status":"draft","score":4},{"id":"R4","status":"rejected","score":2}],"changed_paths":["records/3/status"]}}